{
	"_comment": "Synthetic LIVE anchor receipt — cycle 3 cycleend event.",
	"$schema": "https://metal.freedom-yield.com/api/anchor-receipt.schema.v1.json",
	"schema_version": 1,
	"dag_root_hash": "bbbb000000000000000000000000000000000000000000000000000000000002",
	"memo": "fyid1:bbbb000000000000000000000000000000000000000000000000000000000002",
	"anchor": {
		"chain": "metal-a-chain",
		"chain_backend": "pulsevm",
		"network": "xpr-mainnet",
		"method": "phase_alpha_token_transfer",
		"tx_id": "bbbb000000000000000000000000000000000000000000000000000000000002",
		"block_num": 100086400,
		"block_time": "2026-08-04T04:00:00Z",
		"explorer_url": "https://explorer.xprnetwork.org/transaction/bbbb000000000000000000000000000000000000000000000000000000000002",
		"inscribe_action": {
			"account": "eosio.token",
			"name": "transfer",
			"from": "metalfreedom",
			"to": "fyhistory",
			"quantity": "0.0001 XPR",
			"memo": "fyid1:bbbb000000000000000000000000000000000000000000000000000000000002",
			"permission": {"actor": "metalfreedom", "permission": "anchor"}
		}
	},
	"cycles_history_url": "https://metal.freedom-yield.com/api/cycles-history.json",
	"identity_url": "https://metal.freedom-yield.com/api/identity.json",
	"trigger_event": "cycle_end",
	"trigger_reference": {"cycle_n": 3},
	"signing_actor": "metalfreedom",
	"signing_permission": "anchor",
	"verification_status": "live",
	"generated_at": "2026-08-04T04:00:30Z"
}
