{
	"_comment": "Synthetic LIVE anchor receipt — cycle 4 cyclestart event.",
	"$schema": "https://metal.freedom-yield.com/api/anchor-receipt.schema.v1.json",
	"schema_version": 1,
	"dag_root_hash": "cccc000000000000000000000000000000000000000000000000000000000003",
	"memo": "fyid1:cccc000000000000000000000000000000000000000000000000000000000003",
	"anchor": {
		"chain": "metal-a-chain",
		"chain_backend": "pulsevm",
		"network": "xpr-mainnet",
		"method": "phase_alpha_token_transfer",
		"tx_id": "cccc000000000000000000000000000000000000000000000000000000000003",
		"block_num": 100086401,
		"block_time": "2026-08-04T04:00:02Z",
		"explorer_url": "https://explorer.xprnetwork.org/transaction/cccc000000000000000000000000000000000000000000000000000000000003",
		"inscribe_action": {
			"account": "eosio.token",
			"name": "transfer",
			"from": "metalfreedom",
			"to": "fyhistory",
			"quantity": "0.0001 XPR",
			"memo": "fyid1:cccc000000000000000000000000000000000000000000000000000000000003",
			"permission": {"actor": "metalfreedom", "permission": "anchor"}
		}
	},
	"cycles_history_url": "https://metal.freedom-yield.com/api/cycles-history.json",
	"identity_url": "https://metal.freedom-yield.com/api/identity.json",
	"trigger_event": "cycle_start",
	"trigger_reference": {"cycle_n": 4},
	"signing_actor": "metalfreedom",
	"signing_permission": "anchor",
	"verification_status": "live",
	"generated_at": "2026-08-04T04:00:32Z"
}
