{
	"_comment": "Synthetic schema example for /api/anchor-receipt.schema.v1.json. This file is NOT a snapshot of any production inscription — it is a fixed demonstration of the schema's shape. All hex strings, tx_ids, block numbers, and timestamps shown here are synthetic placeholders that document field formats only; they do not refer to any real on-chain transaction or moment in time. The operator XPR account 'metalfreedom' and the sink account 'fyhistory' are the confirmed production names on Metal A-chain mainnet (= the runtime receipt will carry exactly these values); only the time-varying fields (tx_id, block_num, block_time, dag_root_hash, hashes) are synthetic. Production runtime receipt is published at /api/anchor-receipt.json by scripts/post-anchor-event.sh on the validator host. See docs/MERKLE_DAG_SPEC.md.",
	"$schema": "https://metal.freedom-yield.com/api/anchor-receipt.schema.v1.json",
	"schema_version": 1,
	"dag_root_hash": "0000000000000000000000000000000000000000000000000000000000000000",
	"memo": "fyid1:0000000000000000000000000000000000000000000000000000000000000000",
	"anchor": {
		"chain": "metal-a-chain",
		"network": "xpr-mainnet",
		"method": "phase_alpha_token_transfer",
		"tx_id": "0000000000000000000000000000000000000000000000000000000000000000",
		"block_num": 1,
		"block_time": "1970-01-01T00:00:00Z",
		"explorer_url": "https://explorer.xprnetwork.org/transaction/0000000000000000000000000000000000000000000000000000000000000000",
		"inscribe_action": {
			"account": "eosio.token",
			"name": "transfer",
			"from": "metalfreedom",
			"to": "fyhistory",
			"quantity": "0.0001 XPR",
			"memo": "fyid1:0000000000000000000000000000000000000000000000000000000000000000",
			"permission": {
				"actor": "metalfreedom",
				"permission": "anchor"
			}
		}
	},
	"cycles_history_url": "https://metal.freedom-yield.com/api/cycles-history.json",
	"identity_url": "https://metal.freedom-yield.com/api/identity.json",
	"trigger_event": "cycle_start",
	"trigger_reference": {
		"cycle_n": 3
	},
	"generated_at": "1970-01-01T00:00:00Z"
}
